{
  "capability": "attack2defend.resolve_defense_route",
  "input": "CVE-2024-37079",
  "normalized_input": "CVE-2024-37079",
  "input_type": "cve",
  "coverage_status": "action-gap",
  "confidence": "medium",
  "executive_summary_es": "Attack2Defend resolvió CVE-2024-37079 con ruta de amenaza completa y preparación defensiva parcial. La salida está sanitizada para consumo portable por mcp-security.",
  "decision_context_es": "La ruta conecta CVE, CWE, CAPEC, ATT&CK y D3FEND con Control, Detection, Evidence, Gap y Action. La UI y el CLI no requieren llamadas públicas en runtime.",
  "risk_rationale_es": "El riesgo operativo se mantiene en prioridad media porque hay evidencia y acciones modeladas, pero aún existe una brecha de validación que debe cerrarse con owner y evidencia.",
  "threat_route_map": {
    "status": "complete",
    "nodes": [
      {
        "id": "CAPEC-100",
        "type": "capec",
        "name": "Overflow Buffers",
        "description": "",
        "url": "https://capec.mitre.org/data/definitions/100.html",
        "official_link": "https://capec.mitre.org/data/definitions/100.html",
        "source_ref": "data/mappings/backbone_core.json",
        "metadata": {
          "source_kind": "public-compatible",
          "source_ref": "data/mappings/backbone_core.json"
        }
      },
      {
        "id": "CVE-2024-37079",
        "type": "cve",
        "name": "VMware vCenter Server DCERPC heap-overflow RCE",
        "description": "",
        "url": "https://nvd.nist.gov/vuln/detail/CVE-2024-37079",
        "official_link": "https://nvd.nist.gov/vuln/detail/CVE-2024-37079",
        "source_ref": "data/mappings/backbone_core.json",
        "metadata": {
          "product_family": "VMware vCenter Server",
          "source_kind": "public-compatible",
          "source_ref": "data/mappings/backbone_core.json"
        }
      },
      {
        "id": "CWE-787",
        "type": "cwe",
        "name": "Out-of-bounds Write",
        "description": "",
        "url": "https://cwe.mitre.org/data/definitions/787.html",
        "official_link": "https://cwe.mitre.org/data/definitions/787.html",
        "source_ref": "missing_source_ref",
        "metadata": {}
      },
      {
        "id": "D3-NTA",
        "type": "d3fend",
        "name": "Network Traffic Analysis",
        "description": "",
        "url": "https://d3fend.mitre.org/technique/d3f:NetworkTrafficAnalysis/",
        "official_link": "https://d3fend.mitre.org/technique/D3-NTA/",
        "source_ref": "missing_source_ref",
        "metadata": {}
      },
      {
        "id": "T1190",
        "type": "attack",
        "name": "Exploit Public-Facing Application",
        "description": "",
        "url": "https://attack.mitre.org/techniques/T1190/",
        "official_link": "https://attack.mitre.org/techniques/T1190/",
        "source_ref": "data/mappings/backbone_core.json",
        "metadata": {
          "source_kind": "public-compatible",
          "source_ref": "data/mappings/backbone_core.json"
        }
      }
    ],
    "edges": [
      {
        "source": "CVE-2024-37079",
        "target": "CWE-787",
        "relationship": "vulnerability_has_weakness",
        "confidence": "curated",
        "source_ref": "generated:knowledge_builder:sample_bundle"
      },
      {
        "source": "CWE-787",
        "target": "CAPEC-100",
        "relationship": "weakness_enables_attack_pattern",
        "confidence": "curated",
        "source_ref": "generated:knowledge_builder:sample_bundle"
      },
      {
        "source": "CAPEC-100",
        "target": "T1190",
        "relationship": "attack_pattern_maps_to_technique",
        "confidence": "high",
        "source_ref": "baseline:capec-attack"
      },
      {
        "source": "T1190",
        "target": "D3-NTA",
        "relationship": "validated_by_detection",
        "confidence": "medium",
        "source_ref": "generated:knowledge_builder:sample_bundle"
      }
    ],
    "missing_segments": [],
    "official_links": [
      {
        "node_id": "CAPEC-100",
        "node_type": "capec",
        "url": "https://capec.mitre.org/data/definitions/100.html",
        "source": "official_framework"
      },
      {
        "node_id": "CVE-2024-37079",
        "node_type": "cve",
        "url": "https://nvd.nist.gov/vuln/detail/CVE-2024-37079",
        "source": "official_framework"
      },
      {
        "node_id": "CWE-787",
        "node_type": "cwe",
        "url": "https://cwe.mitre.org/data/definitions/787.html",
        "source": "official_framework"
      },
      {
        "node_id": "D3-NTA",
        "node_type": "d3fend",
        "url": "https://d3fend.mitre.org/technique/D3-NTA/",
        "source": "official_framework"
      },
      {
        "node_id": "T1190",
        "node_type": "attack",
        "url": "https://attack.mitre.org/techniques/T1190/",
        "source": "official_framework"
      }
    ],
    "source_refs": [
      "baseline:capec-attack",
      "baseline:cve-2024-37079",
      "baseline:cwe-capec",
      "coverage:CVE-2024-37079",
      "data/mappings/backbone_core.json",
      "generated:knowledge_builder:sample_bundle"
    ]
  },
  "defense_readiness_map": {
    "status": "action-gap",
    "summary_es": "Defense Readiness muestra cobertura parcial: hay Control, Detection, Evidence, Gap y Action, pero permanece una brecha operativa pendiente de cierre.",
    "controls": [
      {
        "id": "CTRL-VIRTUAL-PATCH",
        "type": "control",
        "name": "Virtual patch / perimeter restriction",
        "description": "",
        "url": "",
        "official_link": "",
        "source_ref": "missing_source_ref",
        "metadata": {
          "source_gap": "missing_source_ref"
        }
      }
    ],
    "detections": [
      {
        "id": "DET-RPC-EXPLOIT-ATTEMPT",
        "type": "detection",
        "name": "Suspicious RPC exploit attempt against vCenter",
        "description": "",
        "url": "",
        "official_link": "",
        "source_ref": "missing_source_ref",
        "metadata": {
          "source_gap": "missing_source_ref"
        }
      }
    ],
    "evidence": [
      {
        "id": "EV-FIREWALL-LOGS",
        "type": "evidence",
        "name": "Firewall or load balancer logs",
        "description": "",
        "url": "",
        "official_link": "",
        "source_ref": "missing_source_ref",
        "metadata": {
          "source_gap": "missing_source_ref"
        }
      }
    ],
    "gaps": [
      {
        "id": "GAP-CVE-2024-37079-1",
        "type": "gap",
        "name": "Confirm affected vCenter exposure and version",
        "description": "Confirm affected vCenter exposure and version",
        "url": "",
        "official_link": "",
        "source_ref": "coverage:CVE-2024-37079",
        "metadata": {
          "source_ref": "coverage:CVE-2024-37079",
          "related_id": "CVE-2024-37079"
        }
      },
      {
        "id": "GAP-MISSING-APP-HTTP-LOGS",
        "type": "gap",
        "name": "Missing normalized application or reverse proxy HTTP logs",
        "description": "",
        "url": "",
        "official_link": "",
        "source_ref": "data/mappings/backbone_core.json",
        "metadata": {
          "source_kind": "public-compatible",
          "source_ref": "data/mappings/backbone_core.json"
        }
      }
    ],
    "actions": [
      {
        "id": "ACT-APPSEC-ENABLE-HTTP-TELEMETRY",
        "type": "action",
        "name": "Enable normalized application and reverse proxy HTTP telemetry",
        "description": "",
        "url": "",
        "official_link": "",
        "source_ref": "data/mappings/backbone_core.json",
        "metadata": {
          "source_kind": "public-compatible",
          "source_ref": "data/mappings/backbone_core.json"
        }
      }
    ],
    "gap_explanation_es": "El bundle mantiene una brecha de validación sobre exposición/versionado de vCenter y una acción modelada para cerrar telemetría HTTP faltante.",
    "missing_segments": [
      "action"
    ],
    "source_refs": [
      "baseline:capec-attack",
      "baseline:cve-2024-37079",
      "baseline:cwe-capec",
      "coverage:CVE-2024-37079",
      "data/mappings/backbone_core.json",
      "generated:knowledge_builder:sample_bundle"
    ]
  },
  "bridges": [
    {
      "source": "D3-NTA",
      "target": "CTRL-VIRTUAL-PATCH",
      "relationship": "implemented_by_control",
      "confidence": "internal_control_mapping",
      "source_ref": "generated:knowledge_builder:sample_bundle"
    },
    {
      "source": "CTRL-VIRTUAL-PATCH",
      "target": "DET-RPC-EXPLOIT-ATTEMPT",
      "relationship": "validated_by_detection",
      "confidence": "internal_detection_mapping",
      "source_ref": "generated:knowledge_builder:sample_bundle"
    },
    {
      "source": "DET-RPC-EXPLOIT-ATTEMPT",
      "target": "EV-FIREWALL-LOGS",
      "relationship": "requires_evidence",
      "confidence": "internal_evidence_mapping",
      "source_ref": "generated:knowledge_builder:sample_bundle"
    },
    {
      "source": "GAP-MISSING-APP-HTTP-LOGS",
      "target": "ACT-APPSEC-ENABLE-HTTP-TELEMETRY",
      "relationship": "closed_by_action",
      "confidence": "high",
      "source_ref": "curated:action"
    }
  ],
  "priority": {
    "threat_relevance": "known",
    "exposure": "unknown",
    "defense_gap": "medium",
    "final_priority": "medium",
    "rationale": "Priority derived from bundle coverage only. GTI enrichment not applied.",
    "rationale_es": "Prioridad media: existe cobertura parcial, pero queda una brecha operativa pendiente de cierre verificable."
  },
  "recommended_actions": [
    {
      "id": "ACT-APPSEC-ENABLE-HTTP-TELEMETRY",
      "type": "action",
      "description_es": "Ejecutar la accion de remediacion registrada en el bundle.",
      "owner_guidance_es": "Asignar al owner operativo indicado en coverage y validar evidencia de cierre.",